{"schema_version":"mindclade.provider-manifest/v1","kind":"ProviderManifest","metadata":{"uid":"provider-reference-v1","created_at":"2026-08-31T12:00:00Z","producer":"kernel-platform","classification":"INTERNAL"},"spec":{"provider_id":"reference.cpu","provider_version":"1.0.0","source_revision":"sha256:aaaaaaaaaaaaaaaaaaaaaaaaaaaaaaaaaaaaaaaaaaaaaaaaaaaaaaaaaaaaaaaa","capabilities":["matmul.fp32","reduction.sum"],"configuration_schema":{"uri":"artifacts/provider-schemas/reference-cpu-v1","digest":"sha256:bbbbbbbbbbbbbbbbbbbbbbbbbbbbbbbbbbbbbbbbbbbbbbbbbbbbbbbbbbbbbbbb","media_type":"application/schema+json","schema_version":"mindclade.provider-configuration/v1"},"qualification":{"uri":"artifacts/qualifications/reference-cpu-v1","digest":"sha256:cccccccccccccccccccccccccccccccccccccccccccccccccccccccccccccccc","media_type":"application/schema+json","schema_version":"mindclade.kernel-qualification/v1"},"qualification_verified":true},"lineage":[{"uri":"artifacts/sources/reference-cpu-v1","digest":"sha256:aaaaaaaaaaaaaaaaaaaaaaaaaaaaaaaaaaaaaaaaaaaaaaaaaaaaaaaaaaaaaaaa","media_type":"application/vnd.mindclade.source+tar","schema_version":"mindclade.source-bundle/v1"}],"integrity":{"payload_digest":"sha256:dddddddddddddddddddddddddddddddddddddddddddddddddddddddddddddddd","evidence":[]}}
